question	sentence	index	times
What would need to remain constant in a multiplication algorithm to produce the same outcome whether multiplying or squaring two integers?	Indeed, this can be done by giving the same input to both inputs of the multiplication algorithm.	entailment	1
Prior to the popularity of lethal injection, what was the preferred method of executing criminals in America?	Some, particularly in Florida, were noted for malfunctions, which caused discussion of their cruelty and resulted in a shift to lethal injection as the preferred method of execution.	not_entailment	1
At what size and larger can drugs elicit a neutralizing immune response?	This limits the effectiveness of drugs based on larger peptides and proteins (which are typically larger than 6000 Da).	not_entailment	1
What was the purpose of the fruit walls built by French and English farmers?	During the short growing seasons of the Little Ice Age, French and English farmers employed fruit walls to maximize the collection of solar energy.	not_entailment	1
What natural resources did the Chinese government have a monopoly on?	He instituted the reforms proposed by his Chinese advisers by centralizing the bureaucracy, expanding the circulation of paper money, and maintaining the traditional monopolies on salt and iron.	entailment	1
What position did Victoria take on being shot at?	On 2 March 1882, Roderick Maclean, a disgruntled poet apparently offended by Victoria's refusal to accept one of his poems, shot at the Queen as her carriage left Windsor railway station.	not_entailment	1
What was the only year that a full series was not filmed since 2005?	There have since been nine further series in 2006–2008 and 2010–2015, and Christmas Day specials every year since 2005.	not_entailment	1
Who is properly in the major office in the commonwealth?	"""Few szlachta were wealthy enough to be known as magnates (karmazyni—the """"Crimsons"""", from the crimson colour of their boots)."""	entailment	1
How was Erichtho portrayed?	"""Lucan depicts Sextus Pompeius, the doomed son of Pompey the Great, as convinced """"the gods of heaven knew too little"""" and awaiting the Battle of Pharsalus by consulting with the Thessalian witch Erichtho, who practices necromancy and inhabits deserted graves, feeding on rotting corpses."""	not_entailment	1
FireWire 400 is faster than what?	The newer FireWire 800 standard is twice as fast as FireWire 400 and faster than USB 2.0 Hi-Bandwidth both theoretically and practically.	not_entailment	1
"""When was """"The Aims of Education and Other Essays"""" published?"""	The Aims of Education and Other Essays, which collected numerous essays and addresses by Whitehead on the subject published between 1912 and 1927.	not_entailment	1
What are roche moutonnee?	"""Some rock formations in the path of a glacier are sculpted into small hills called roche moutonnée, or """"sheepback"""" rock."""	not_entailment	1
What did the REF give Imperial as an overall GPA?	"""In rankings produced by Times Higher Education based upon the REF results Imperial was ranked 2nd overall for GPA and 8th for """"research power"""" (compared to 6th and 7th respectively in the equivalent rankings for the RAE 2008)."""	not_entailment	1
Where did most settlement occur after the Louisiana Purchase?	Also referred to as the Panhandle or Inside Passage, this is the region of Alaska closest to the rest of the United States.	entailment	1
Who was the founder of Manjupattan?	The lake was cut drained by Bodhisatwa Manjusri with his sword and the water was evacuated out from there	entailment	1
In 1913, the Tennessee state legislature made which organizational structure the default form of city government in the state?	In the early 1900s, the state legislature approved a form of commission government for cities based on at-large voting for a few positions on a Board of Commission; several adopted this as another means to limit African-American political participation.	entailment	1
"""What is """"the american colonization society""""?"""	In the United States, there was a movement to resettle American free blacks and freed slaves in Africa.	entailment	1
What types of work did the Han do in Central Asia?	At the same time the Mongols imported Central Asian Muslims to serve as administrators in China, the Mongols also sent Han Chinese and Khitans from China to serve as administrators over the Muslim population in Bukhara in Central Asia, using foreigners to curtail the power of the local peoples of both lands.	not_entailment	1
In Swaziland, what is SIMPA?	In addition to these institutions, Swaziland also has the Swaziland Institute of Management and Public Administration (SIMPA) and Institute of Development Management (IDM).	not_entailment	1
On what date in 2011 was the hold on Schwarzenegger's movie projects announced?	On July 11, 2011, it was announced that Schwarzenegger was considering a comeback film despite his legal problems.	not_entailment	1
What problems could occur with laser rot?	"""This was a problem that was termed """"laser rot"""" among LD enthusiasts, also called """"color flash"""" internally by LaserDisc-pressing plants."""	not_entailment	1
Before which military campaign did Chagatai publicly dispute Jochi's paternity?	In The Secret History of the Mongols, just before the invasion of the Khwarezmid Empire by Genghis Khan, Chagatai declared before his father and brothers that he would never accept Jochi as Genghis Khan's successor.	entailment	1
Where in the bulb is evaporated tungsten deposited when a vacuum is used?	For bulbs that contain a vacuum, the darkening is uniform across the entire surface of the envelope.	entailment	1
What has many organizations claiming ownership of patents related to aspects of MP3 led to?	In the past, many organizations have claimed ownership of patents related to MP3 decoding or encoding.	not_entailment	1
What impact did this loss have on Abercrombie?	Abercrombie saved something from the disaster when he sent John Bradstreet on an expedition that successfully destroyed Fort Frontenac, including caches of supplies destined for New France's western forts and furs destined for Europe.	not_entailment	1
In what language did Anjiro speak to Xavier?	Xavier made the decision to go to Japan in part because this low-ranking samurai convinced him in Portuguese that the Japanese people were highly educated and eager to learn.	entailment	1
What religion is the western region mostly?	The upper part of Kenya's Eastern Region is home to 10% of the country's Muslims, where they constitute the majority religious group.	not_entailment	1
How many species have ever lived on earth?	Estimates on the number of Earth's current species range from 10 million to 14 million, of which about 1.2 million have been documented and over 86 percent have not yet been described.	not_entailment	1
Who agreed to turn the United Provinces into a protectorate of England?	However, the latter agreed to turn the United Provinces into a protectorate of England (Treaty of Nonsuch, 1585), and sent the Earl of Leicester as governor-general.	not_entailment	1
What success did Abercrombie gain out of the defeat at Carillon?	The third invasion was stopped with the improbable French victory in the Battle of Carillon, in which 3,600 Frenchmen famously and decisively defeated Abercrombie's force of 18,000 regulars, militia and Native American allies outside the fort the French called Carillon and the British called Ticonderoga.	not_entailment	1
In which year were these allegations raised?	Nevertheless, allegations of bullying have continued: in 2007, concerns were raised about the methods that were being used to fire people in the Faculty of Medicine.	not_entailment	1
In what year did Tesla graduate from the Higher Real Gymnasium?	In 1870, Tesla moved to Karlovac, to attend school at the Higher Real Gymnasium, where he was profoundly influenced by a math teacher Martin Sekulić.:32	not_entailment	1
Which political party holds the majority of most office terms in NYC?	The Democratic Party holds the majority of public offices.	not_entailment	1
Cubism revolutionized the way things could be seen in art how?	This new kind of depiction revolutionized the way objects could be visualized in painting and art.	not_entailment	1
Who signed NAFTA for Mexico?	The economic reforms of President Carlos Salinas de Gortari had a tremendous effect on the city, as a number of businesses, including banks and airlines, were privatized.	entailment	1
The 1998 Good Friday Agreement resulted in what arrangement?	The Northern Ireland Executive and the Government of Ireland also meet as the North/South Ministerial Council to develop policies common across the island of Ireland.	entailment	1
What was AUSTPAC	Started by Telecom Australia in the early 1980s, AUSTPAC was Australia's first public packet-switched data network, supporting applications such as on-line betting, financial applications — the Australian Tax Office made use of AUSTPAC — and remote terminal access to academic institutions, who maintained their connections to AUSTPAC up until the mid-late 1990s in some cases.	not_entailment	1
Who missed a field goal for the Panthers?	But the Broncos defense halted the drive on the 26-yard line, and it ended with no points when Graham Gano hit the uprights on a 44-yard field goal attempt.	entailment	1
What does it mean when someones sexualiity is fluid?	such that one's sexual orientation is not necessarily stable or consistent over time but is subject to change throughout life.	entailment	1
What did the Mongol elites wish Buyantu didn't do?	He was the first Yuan emperor to actively support and adopt mainstream Chinese culture after the reign of Kublai, to the discontent of some Mongol elite.	entailment	1
What is considered to be the the Korean War's equivalent to Gettysburg?	In mid-February, the PVA counterattacked with the Fourth Phase Offensive and achieved initial victory at Hoengseong.	entailment	1
What was the GDP growth rate of Greece in 2013?	Greece achieved a real GDP growth rate of 0.7% in 2014 after 6 years of economic decline, but fell back into recession in 2015.	not_entailment	1
Who ordered that a hymn be composed that first mentioned the Somalis?	During the wars between the Sultanate of Ifat based at Zeila and the Solomonic Dynasty, the Abyssinian Emperor had one of his court officials compose a hymn celebrating a military victory over the Sultan of Ifat's eponymous troops.	entailment	1
What kind of bureaucracy did the Normans institute?	Institutionally, the Normans combined the administrative machinery of the Byzantines, Arabs, and Lombards with their own conceptions of feudal law and order to forge a unique government.	not_entailment	1
Who had Toghtogha tried to defeat?	He had tried to regain Khanbaliq, which eventually failed; he died in Yingchang (located in present-day Inner Mongolia)	not_entailment	1
What do ctenophores have that no other animals have?	Ctenophores form an animal phylum that is more complex than sponges, about as complex as cnidarians (jellyfish, sea anemones, etc.), and less complex than bilaterians (which include almost all other animals).	not_entailment	1
Where is the neighborhood of Sunnyside located in Fresno?	"""Although parts of Sunnyside are within the City of Fresno, much of the neighborhood is a """"county island"""" within Fresno County."""	not_entailment	1
How was the fate of Luther decided?	"""The Emperor presented the final draft of the Edict of Worms on 25 May 1521, declaring Luther an outlaw, banning his literature, and requiring his arrest: """"We want him to be apprehended and punished as a notorious heretic."""	not_entailment	1
What types of European groups were able to avoid the plague?	The plague was somewhat less common in parts of Europe that had smaller trade relations with their neighbours, including the Kingdom of Poland, the majority of the Basque Country, isolated parts of Belgium and the Netherlands, and isolated alpine villages throughout the continent.	entailment	1
How many member of the Association of American Universities are in Boston?	Four members of the Association of American Universities are in Greater Boston (more than any other metropolitan area):	not_entailment	1
What kind of bombing raids were most favored?	It was thought there was no defence against air attack, particularly at night.	entailment	1
Who wrote the story on Tulisa Contostavlos?	On Sunday's undercover reporter Mahzer Mahmood, who had previously worked for the News of the World.	entailment	1
What festival is held in October in Newcastle?	The SAMA Festival, an East Asian cultural festival is also held in early October.	not_entailment	1
What geographical region lies west of the Tennessee bottom land?	To the west of this narrow strip of land is a wide area of rolling hills and streams that stretches all the way to the Mississippi River; this area is called the Tennessee Bottoms or bottom land.	not_entailment	1
Because higher performance was needed, Krupp's workers designed what?	Germany's high-altitude needs were originally going to be filled by a 75 mm gun from Krupp, designed in collaboration with their Swedish counterpart Bofors, but the specifications were later amended to require much higher performance.	not_entailment	1
What percentage of loanwords are present in Dutch vocabulary?	The main foreign influence on Dutch vocabulary since the 12th century and culminating in the French period has been French and (northern) French, accounting for an estimated 6.8%, or more than a third of all loanwords.	not_entailment	1
Where was media day for Super Bowl 50 held?	The game's media day, which was typically held on the Tuesday afternoon prior to the game, was moved to the Monday evening and re-branded as Super Bowl Opening Night.	not_entailment	1
Which companies did Nintendo try to get to make a CD add-on for the SNES?	During the SNES's life, Nintendo contracted with two different companies to develop a CD-ROM-based peripheral for the console to compete with Sega's CD-ROM based addon, Mega-CD.	not_entailment	1
What number was the Tironian note visually similar to?	The remaining 20 Latin letters were supplemented by four more: ⟨æ⟩ (æsc, modern ash) and ⟨ð⟩ (ðæt, now called eth or edh), which were modified Latin letters, and thorn ⟨þ⟩ and wynn ⟨ƿ⟩, which are borrowings from the futhorc.	entailment	1
When was he elected by Nixon?	In 1973, Nixon named William E. Simon as the first Administrator of the Federal Energy Office, a short-term organization created to coordinate the response to the embargo.	entailment	1
Where is the border of Swiss and Austria?	The Rhine flows into it from the south following the Swiss-Austrian border.	not_entailment	1
"""Who recognizes the """"Middle East and North Africa"""" region?"""	UNESCO recognizes neither a Near East nor a Middle East, dividing the countries instead among three regions: Arab States, Asia and the Pacific, and Africa.	not_entailment	1
Who did Genghis Khan charge with finding and punishing the Shah?	Genghis Khan ordered Subutai and Jebe to hunt him down, giving them 20,000 men and two years to do this.	entailment	1
What project structures assist the owner in integration?	In general, each of these project structures allows the owner to integrate the services of architects, interior designers, engineers and constructors throughout design and construction.	not_entailment	1
"""What is the 'Early Modern period"""" known as in Japan?"""	In Japan, the Edo period from 1600 to 1868 is also referred to as the early modern period.	not_entailment	1
The mahayana occasionally referred to early Buddhism as what?	"""Jonathan Silk has argued that the term """"Hinayana"""" was used to refer to whomever one wanted to criticize on any given occasion, and did not refer to any definite grouping of Buddhists."""	entailment	1
How many horsepower did Tesla's bladeless turbine have?	During 1910–1911 at the Waterside Power Station in New York, several of his bladeless turbine engines were tested at 100–5,000 hp.	not_entailment	1
Eye gaze, vocalization and body posture are examples of what?	"""Dog communication is about how dogs """"speak"""" to each other, how they understand messages that humans send to them, and how humans can translate the ideas that dogs are trying to transmit.:xii"""	entailment	1
What march successfully pressured the national government to sign the ILO Convetion 169?	That march successfully pressured the national government to sign the ILO Convention 169 and to begin the still-ongoing process of recognizing and titling indigenous territories.	not_entailment	1
Alhazen's  experimental proof of the intromission model of vision led to the change of understanding of what?	His experimental proof of the intromission model of vision led to changes in the understanding of the visual perception of space, contrary to the previous emission theory of vision supported by Euclid and Ptolemy.	not_entailment	1
What was the horsepower put out by the turbines in Waterside Power Station	On his 50th birthday in 1906, Tesla demonstrated his 200 horsepower (150 kilowatts) 16,000 rpm bladeless turbine.	not_entailment	1
What was the population of the Dutch Republic before this emigration?	This was a huge influx as the entire population of the Dutch Republic amounted to ca.	not_entailment	1
Who did BSkyB team up with because it was not part of the consortium?	While BSkyB had been excluded from being a part of the ONdigital consortium, thereby making them a competitor by default, BSkyB was able to join ITV Digital's free-to-air replacement, Freeview, in which it holds an equal stake with the BBC, ITV, Channel 4 and National Grid Wireless.	entailment	1
Where do a majority of consultant pharmacists tend to work?	This trend may be gradually reversing as consultant pharmacists begin to work directly with patients, primarily because many elderly people are now taking numerous medications but continue to live outside of institutional settings.	not_entailment	1
How much Victorian farmland is farmed in grains?	More than 26,000 square kilometres (10,000 sq mi) of Victorian farmland are sown for grain, mostly in the state's west.	entailment	1
What does oxygen the basis for in combustion?	Fire and explosion hazards exist when concentrated oxidants and fuels are brought into close proximity; an ignition event, such as heat or a spark, is needed to trigger combustion.	not_entailment	1
What protein carries the majority of copper in blood?	Copper transport here involves the protein ceruloplasmin, which carries the majority of copper in blood.	not_entailment	1
Who first patented a method to produce high-brightness blue LEDs?	Building upon this foundation, Dr. Moustakas at Boston University patented a method for producing high-brightness blue LEDs using a new two-step process.	not_entailment	1
Who recovered Tolbert's fumble?	The Panthers could not gain any yards with their possession and had to punt.	not_entailment	1
Which uses of sculpture are represented in the collection?	The sculpture collection at the V&A is the most comprehensive holding of post-classical European sculpture in the world.	not_entailment	1
What is the ABC affiliate that serves Lima, Ohio?	Currently, New Jersey, Rhode Island and Delaware are the only U.S. states where ABC does not have a locally licensed affiliate (New Jersey is served by New York City O&O WABC-TV and Philadelphia O&O WPVI-TV; Rhode Island is served by New Bedford, Massachusetts-licensed WLNE; and Delaware is served by WPVI and Salisbury, Maryland affiliate WMDT).	not_entailment	1
The largest construction projects are known as what?	The largest construction projects are referred to as megaprojects.	entailment	1
Which Doctor Who-related song reached Number One in the UK?	"""In 1988 the band The Justified Ancients of Mu Mu (later known as The KLF) released the single """"Doctorin' the Tardis"""" under the name The Timelords, which reached No. 1 in the UK and No. 2 in Australia; this version incorporated several other songs, including """"Rock and Roll Part 2"""" by Gary Glitter (who recorded vocals for some of the CD-single remix versions of """"Doctorin' the Tardis"""")."""	entailment	1
What is terra preta called?	Terra preta (black earth), which is distributed over large areas in the Amazon forest, is now widely accepted as a product of indigenous soil management.	entailment	1
In China, this person inferred that the land was formed by erosion of the mountains and by silt deposition, what was his name?	In China, the polymath Shen Kuo (1031–1095) formulated a hypothesis for the process of land formation: based on his observation of fossil animal shells in a geological stratum in a mountain hundreds of miles from the ocean, he inferred that the land was formed by erosion of the mountains and by deposition of silt.	entailment	1
Where is eating insects considered taboo?	According to cultural materialist anthropologist Marvin Harris, the eating of insects is taboo in cultures that have other protein sources such as fish or livestock.	not_entailment	1
People of what nationality invented the steam turbine?	Land-based steam engines could exhaust much of their steam, as feed water was usually readily available.	not_entailment	1
What medical appliance can be a concern for oxygen toxicity?	Oxygen gas (O_2) can be toxic at elevated partial pressures, leading to convulsions and other health problems.[j]	not_entailment	1
When did the 1973 oil crisis begin?	"""It was later called the """"first oil shock"""", followed by the 1979 oil crisis, termed the """"second oil shock."""""""	not_entailment	1
Who is also known at the father of the hydrogen bomb?	"""Notable faculty in physics have included the speed of light calculator A. A. Michelson, elementary charge calculator Robert A. Millikan, discoverer of the Compton Effect Arthur H. Compton, the creator of the first nuclear reactor Enrico Fermi, """"the father of the hydrogen bomb"""" Edward Teller, """"one of the most brilliant and productive experimental physicists of the twentieth century"""	entailment	1
Who granted Newcastle a new charter in 1589?	Incorporated first by Henry II, the city had a new charter granted by Elizabeth in 1589.	entailment	1
Great Smoky mountain and Blue Ridge Parkway are located in what mountain range?	Every year the Appalachian Mountains attract several million tourists to the Western part of the state, including the historic Biltmore Estate.	entailment	1
What kind of techniques were used to create the theme?	New techniques were invented to allow mixing of the music, as this was before the era of multitrack tape machines.	not_entailment	1
What is another type of accountant other than a CPA?	Teaching may be carried out informally, within the family, which is called homeschooling, or in the wider community.	not_entailment	1
What did the Church do when Luther refused to retract his writings?	Luther came to reject several teachings and practices of the Late Medieval Catholic Church.	not_entailment	1
When did the so called gentlemen's agreement between Sadat and the Islamists break down?	"""This """"gentlemen's agreement"""" between Sadat and Islamists broke down in 1975 but not before Islamists came to completely dominate university student unions."""	entailment	1
Who was Louis XIV's main rival?	Stadtholder William III of Orange, who later became King of England, emerged as the strongest opponent of king Louis XIV after the French attacked the Dutch Republic in 1672.	entailment	1
What did the civil war leave the state of Afghanistan's economy in?	In Afghanistan, the mujahideen's victory against the Soviet Union in the 1980s did not lead to justice and prosperity, due to a vicious and destructive civil war between political and tribal warlords, making Afghanistan one of the poorest countries on earth.	entailment	1
In what city's Marriott did the Panthers stay?	The Broncos practiced at Stanford University and stayed at the Santa Clara Marriott.	not_entailment	1
What was the attack on the British weakness?	Scouts had reported the weakness of the British supply chain, so he ordered an attack against the forts Shirley had erected at the Oneida Carry.	not_entailment	1
What reason is given that you should also protest public companies?	"""Brownlee argues that disobedience in opposition to the decisions of non-governmental agencies such as trade unions, banks, and private universities can be justified if it reflects """"a larger challenge to the legal system that permits those decisions to be taken""""."""	entailment	1
How much has global mean surface air temperature changed in the last century?	"""They predict that under a """"business as usual"""" (BAU) scenario, global mean temperature will increase by about 0.3 °C per decade during the [21st] century."""	not_entailment	1
What did Schurf's letter say  Luther's return caused?	"""After the sixth sermon, the Wittenberg jurist Jerome Schurf wrote to the elector: """"Oh, what joy has Dr. Martin's return spread among us!"""	entailment	1
Who gave Genghis Khan the title Khadan?	The title Khagan was not conferred on Genghis until after his death, when his son and successor, Ögedei, took the title for himself and extended it posthumously to his father (as he was also to be posthumously declared the founder of the Yuan dynasty).	entailment	1
Which two Mongol leaders added Persia to the Mongol Empire?	The famous cavalry expedition led by Subutai and Jebe, in which they encircled the entire Caspian Sea defeating all armies in their path, remains unparalleled to this day, and word of the Mongol triumphs began to trickle to other nations, particularly Europe.	entailment	1
What is student motivation about school linked to?	Useful teacher-to-student interactions are crucial in linking academic success with personal achievement.	not_entailment	1
