question	sentence	index	times
What dilemma is a good example of moral civil disobedience?	"""The Fully Informed Jury Association's publication """"A Primer for Prospective Jurors"""" notes, """"Think of the dilemma faced by German citizens when Hitler's secret police demanded to know if they were hiding a Jew in their house."""""""	entailment	1
Who was responsible for the preliminary archaeological research at Ologesailie and Hyrax Hill?	Later work at the former site was undertaken by Glynn Isaac.	not_entailment	1
What is another name for the Yosemite Freeway?	State Route 41	entailment	1
What is the time period of this statistic?	A study by the American Association of University Women reported that 9.6% of students in the United States claim to have received unwanted sexual attention from an adult associated with education; be they a volunteer, bus driver, teacher, administrator or other adult; sometime during their educational career.	entailment	1
When did Great Britain colonize Australia?	The country of Australia serves as a case study in relation to British settlement and colonial rule of the continent in the eighteenth century, as it was premised on terra nullius, and its settlers considered it unused by its sparse Aboriginal inhabitants.	entailment	1
Who handled pre-game coverage on Westwood One?	Westwood One will carry the game throughout North America, with Kevin Harlan as play-by-play announcer, Boomer Esiason and Dan Fouts as color analysts, and James Lofton and Mark Malone as sideline reporters.	not_entailment	1
What tribe did Toghrul lead?	Temüjin turned to Toghrul for support, and in response, Toghrul offered his vassal 20,000 of his Keraite warriors and suggested that he also involve his childhood friend Jamukha, who had himself become Khan (ruler) of his own tribe, the Jadaran.	not_entailment	1
What should secondary training provide a student in the secondary stage of school?	He writes that children after the age of 14 should be allowed to choose and specialise in subjects they have an interest in, whether it was reading, manual skills, literature, preaching, medicine, geometry, trade and commerce, craftsmanship, or any other subject or profession they would be interested in pursuing for a future career.	entailment	1
What don't chloroplastidan chloroplasts have?	They differ from glaucophyte and red algal chloroplasts in that they have lost their phycobilisomes, and contain chlorophyll	not_entailment	1
In a type III secretion system, proteins are transported to the host cell in order to do what?	Alternatively, using a type III secretion system, they may insert a hollow tube into the host cell, providing a direct route for proteins to move from the pathogen to the host.	not_entailment	1
Who did Tesla call in the middle of the night?	On one occasion at his laboratory, Tesla worked for a period of 84 hours without sleep or rest.:208 Kenneth Swezey, a journalist whom Tesla had befriended, confirmed that Tesla rarely slept.	entailment	1
Who did the SNP obtain 16 seats from?	The SNP took a further eight seats from the Liberal Democrats and one seat from the Conservatives.	not_entailment	1
What will ensure and create the framework for the Action Plan to work?	At the launch in March 2013, the Secretary of the Ministry of Planning, National Development and Vision 2030 emphasised that climate will be a central issue in the renewed Medium Term Plan that will be launched in the coming months.	entailment	1
Who had five sacks in nine games as a Carolina Panthers starter?	The Panthers line also featured veteran defensive end Jared Allen, a 5-time pro bowler who was the NFL's active career sack leader with 136, along with defensive end Kony Ealy, who had 5 sacks in just 9 starts.	entailment	1
Who created the 2005 theme for Doctor Who?	American composer John Debney created a new arrangement of Ron Grainer's original theme for Doctor Who in 1996.	not_entailment	1
What position did the tax collector that arrested Thoreau get?	The tax collector who arrested him rose to higher political office, and Thoreau's essay was not published until after the end of the Mexican War.	entailment	1
What is the most important item for civil disobedience to follow through?	The key point is that the spirit of protest should be maintained all the way, whether it is done by remaining in jail, or by evading it.	entailment	1
In which year did John Sheepshanks donated a large collection of paintings?	In 1857 John Sheepshanks donated 233 paintings, mainly by contemporary British artists, and a similar number of drawings to the museum with the intention of forming a 'A National Gallery of British Art', a role since taken on by Tate Britain; artists represented are William Blake, James Barry, Henry Fuseli, Sir Edwin Henry Landseer, Sir David Wilkie, William Mulready, William Powell Frith, Millais and Hippolyte Delaroche.	entailment	1
How many Panthers were designated All-Pro?	Carolina started the season 14–0, not only setting franchise records for the best start and the longest single-season winning streak, but also posting the best start to a season by an NFC team in NFL history, breaking the 13–0 record previously shared with the 2009 New Orleans Saints and the 2011 Green Bay Packers.	not_entailment	1
When was Martin Luther ordained as a priest?	In 1507, he was ordained to the priesthood, and in 1508, von Staupitz, first dean of the newly founded University of Wittenberg, sent for Luther, to teach theology.	entailment	1
When did The Norddeutsche Affinerie electroplating plant first begin production?	The German scientist Gottfried Osann invented powder metallurgy in 1830 while determining the metal's atomic mass; around then it was discovered that the amount and type of alloying element (e.g., tin) to copper would affect bell tones.	entailment	1
What state operates the Abraham Lincoln Presidential Library?	Libraries and museums have been established for other presidents, but they are not part of the NARA presidential library system, and are operated by private foundations, historical societies, or state governments, including the Abraham Lincoln, Rutherford B. Hayes, William McKinley, Woodrow Wilson and Calvin Coolidge libraries.	not_entailment	1
What is another term for anti-aircraft warfare?	NATO refers to airborne air defence as counter-air and naval air defence as anti-aircraft warfare.	not_entailment	1
At its onset, what can be measured in blood or saliva?	Melatonin is absent from the system or undetectably low during daytime.	entailment	1
What responsibilities were pharmacy technicians formerly limited to?	Where it was once the case that pharmacists stayed within the dispensary compounding/dispensing medications, there has been an increasing trend towards the use of trained pharmacy technicians while the pharmacist spends more time communicating with patients.	entailment	1
What is one of the thermochemical processes that has been explored besides electrolysis?	Aside from electrolysis driven by photovoltaic or photochemical cells, several thermochemical processes have also been explored.	not_entailment	1
"""What provided for the creation of new orders known as """"provisional elder?"""""""	At the 1996 General Conference the ordination order of transitional deacon was abolished.	entailment	1
When was Warsaw's stock exchange brought back to life?	Warsaw's first stock exchange was established in 1817 and continued trading until World War II.	not_entailment	1
What was the percentage of Germans attending private high schools in 2008?	Percent of students in private high schools reached 11.1%.	entailment	1
What is thermal mass?	Thermal mass is any material that can be used to store heat—heat from the Sun in the case of solar energy.	entailment	1
What distinguishes granal thylakoids?	There are two types of thylakoids—granal thylakoids, which are arranged in grana, and stromal thylakoids, which are in contact with the stroma.	entailment	1
What did mlolongo system lead to?	The election held in 1988 saw the advent of the mlolongo (queuing) system, where voters were supposed to line up behind their favoured candidates instead of a secret ballot.	not_entailment	1
What city north of New York was settled by Huguenots?	A small group of Huguenots also settled on the south shore of Staten Island along the New York Harbor, for which the current neighborhood of Huguenot was named.	not_entailment	1
Where did Huguenots and Walloons settle in England?	They also settled elsewhere in Kent, particularly Sandwich, Faversham and Maidstone—towns in which there used to be refugee churches.	not_entailment	1
Prior to the Persian Gulf War, where and when was the last major American military conflict?	Iraqi forces were battle-hardened after 8 years of war with Iran, and they were well equipped with late model Soviet tanks and jet fighters, but the antiaircraft weapons were crippled; in comparison, the US had no large-scale combat experience since its withdrawal from Vietnam nearly 20 years earlier, and major changes in US doctrine, equipment and technology since then had never been tested under fire.	entailment	1
Besides drugs, what else do specialty pharmacies provide?	Unlike a traditional community pharmacy where prescriptions for any common medication can be brought in and filled, specialty pharmacies carry novel medications that need to be properly stored, administered, carefully monitored, and clinically managed.	not_entailment	1
What is another term for shortening the admission event?	"""However, as one and the same valve usually controls both steam flows, a short cutoff at admission adversely affects the exhaust and compression periods which should ideally always be kept fairly constant; if the exhaust event is too brief, the totality of the exhaust steam cannot evacuate the cylinder, choking it and giving excessive compression (""""kick back"""").[citation needed]"""	not_entailment	1
What is the largest Nigerian city?	Waste management presents problems in a mega city like Lagos and other major Nigerian cities which are linked with economic development, population growth and the inability of municipal councils to manage the resulting rise in industrial and domestic waste.	entailment	1
What is reduced by using plastid transformation for gene modification?	This makes plastid transformation a valuable tool for the creation and cultivation of genetically modified plants that are biologically contained, thus posing significantly lower environmental risks.	entailment	1
Who recovered the strip ball?	Meanwhile, Denver's offense was kept out of the end zone for three plays, but a holding penalty on cornerback Josh Norman gave the Broncos a new set of downs.	not_entailment	1
What year marked the lowest ratings for the drama Lost?	That year, the sixth and final season of Lost became the drama's lowest-rated season since its debut in 2004.	not_entailment	1
What was the first international event broadcast by ABC?	Leonard Goldenson said that ABC's first international activity was broadcasting the coronation of Queen Elizabeth II in June 1953; CBS and NBC were unable to cover the coronation live due to respective issues with technical problems and flight delays.	entailment	1
How much of the population is Hindu?	The upper part of Kenya's Eastern Region is home to 10% of the country's Muslims, where they constitute the majority religious group.	not_entailment	1
Who is Antigone's father in the play?	One of the oldest depictions of civil disobedience is in Sophocles' play Antigone, in which Antigone, one of the daughters of former King of Thebes, Oedipus, defies Creon, the current King of Thebes, who is trying to stop her from giving her brother Polynices a proper burial.	entailment	1
People behaving with civil disobedience that is not-violent is said to make society have more of what?	"""Christian Bay's encyclopedia article states that civil disobedience requires """"carefully chosen and legitimate means,"""" but holds that they do not have to be non-violent."""	not_entailment	1
Where did the Huguenots land in New York originally?	"""It is said that they landed on the coastline peninsula of Davenports Neck called """"Bauffet's Point"""" after traveling from England where they had previously taken refuge on account of religious persecution, four years before the revocation of the Edict of Nantes."""	entailment	1
What type of medicine did otachi focus on?	The Mongols characterized otachi doctors by their use of herbal remedies, which was distinguished from the spiritual cures of Mongol shamanism.	entailment	1
When did Tesla depart from Colorado Springs?	On 7 January 1900, Tesla left Colorado Springs.[citation needed]	entailment	1
When did Dyrrachium  fall to the Normans?	The Albanian forces could not take part in the ensuing battle because it had started before their arrival.	not_entailment	1
What famous July Fourth holiday movie did Fox pay to advertise a sequel of during the Super Bowl?	Fox paid for Deadpool, X-Men: Apocalypse, Independence Day:	entailment	1
What appears to be used exclusively in Newcastle and surrounding areas?	"""Many words, however, appear to be used exclusively in Newcastle and the surrounding area, such as """"Canny"""" (a versatile word meaning """"good"""", """"nice"""" or """"very""""), """"hacky"""" (""""dirty""""), """"netty"""" (""""toilet""""), """"hoy"""" (""""throw"""", from the Dutch gooien, via West Frisian), """"hockle"""" (""""spit"""")."""	entailment	1
What uses a model of the sound's generator?	These coders use a model of the sound's generator (such as the human vocal tract with LPC) to whiten the audio signal (i.e., flatten its spectrum) before quantization.	not_entailment	1
What is the first major city in the stream of the Rhine?	The most important tributaries in this area are the Ill below of Strasbourg, the Neckar in Mannheim and the Main across from Mainz.	not_entailment	1
What is the main denomination of Christians in Kenya?	The only Jewish synagogue in the country is located in the capital, Nairobi.	not_entailment	1
What is the population of the second largest city in California?	Many of southern California's most developed cities lie along or in close proximity to the coast, with the exception of San Bernardino and Riverside.	not_entailment	1
What present-day company did BankAmericard turn into?	In 1976, BankAmericard was renamed and spun off into a separate company known today as Visa Inc.	entailment	1
What  former administrative building was used for the MSP's offices?	The former administrative building of Lothian Regional Council on George IV Bridge was used for the MSP's offices.	entailment	1
How long would Tesla spend gambling sometimes?	On one occasion at his laboratory, Tesla worked for a period of 84 hours without sleep or rest.:208 Kenneth Swezey, a journalist whom Tesla had befriended, confirmed that Tesla rarely slept.	not_entailment	1
What person helped establish the school with a donation?	Founded by the American Baptist Education Society with a donation from oil magnate and wealthiest man in history John D. Rockefeller, the University of Chicago was incorporated in 1890; William Rainey Harper became the university's first president in 1891, and the first classes were held in 1892.	entailment	1
In which year was the Salting Bequest?	The collection of Middle Eastern and Persian rugs and carpets is amongst the finest in the world, many were part of the Salting Bequest of 1909.	entailment	1
Along with public schools, what type of school was recognized under the South African Schools Act?	"""The South African Schools Act of 1996 recognises two categories of schools: """"public"""" (state-controlled) and """"independent"""" (which includes traditional private schools and schools which are privately governed[clarification needed].)"""	entailment	1
What property of the harmonic series 1 + 1/2 + 1/3 + 1/4 + ... shows that there is an infinite number of primes?	However, the harmonic series 1 + 1/2 + 1/3 + 1/4 + ... diverges (i.e., exceeds any given number), so there must be infinitely many primes.	entailment	1
Which president ended the Emergency Energy Conservation Act?	Development of the Strategic Petroleum Reserve began in 1975, and in 1977 the cabinet-level Department of Energy was created, followed by the National Energy Act of 1978.[citation needed]	not_entailment	1
How did the original  Constitution identify its society members ?	According to the second article of the first Greek constitution of 1822, a Greek was defined as any Christian resident of the Kingdom of Greece, a clause removed by 1840.	entailment	1
